{
  "$schema": "https://json-schema.org/draft/2020-12/schema",
  "type": "object",
  "properties": {
    "schemaVersion": {
      "type": "number",
      "const": 1
    },
    "currentVersion": {
      "type": "string",
      "pattern": "^[a-zA-Z0-9][a-zA-Z0-9._+-]{0,95}$"
    },
    "locale": {
      "type": "string",
      "pattern": "^[a-z]{2,3}(?:-[A-Za-z0-9]{2,8})*$"
    },
    "viewChannel": {
      "type": "string",
      "pattern": "^(?!(?:con|prn|aux|nul|com[1-9]|lpt[1-9])$)[a-z][a-z0-9-]{0,62}$"
    },
    "currentChannel": {
      "type": "string",
      "pattern": "^(?!(?:con|prn|aux|nul|com[1-9]|lpt[1-9])$)[a-z][a-z0-9-]{0,62}$"
    },
    "releases": {
      "type": "array",
      "items": {
        "type": "object",
        "properties": {
          "version": {
            "type": "string",
            "pattern": "^[a-zA-Z0-9][a-zA-Z0-9._+-]{0,95}$"
          },
          "channel": {
            "type": "string",
            "pattern": "^(?!(?:con|prn|aux|nul|com[1-9]|lpt[1-9])$)[a-z][a-z0-9-]{0,62}$"
          },
          "releasedAt": {
            "anyOf": [
              {
                "type": "string",
                "format": "date",
                "pattern": "^(?:(?:\\d\\d[2468][048]|\\d\\d[13579][26]|\\d\\d0[48]|[02468][048]00|[13579][26]00)-02-29|\\d{4}-(?:(?:0[13578]|1[02])-(?:0[1-9]|[12]\\d|3[01])|(?:0[469]|11)-(?:0[1-9]|[12]\\d|30)|(?:02)-(?:0[1-9]|1\\d|2[0-8])))$"
              },
              {
                "type": "string",
                "allOf": [
                  {
                    "pattern": "^(?:(?:\\d\\d[2468][048]|\\d\\d[13579][26]|\\d\\d0[48]|[02468][048]00|[13579][26]00)-02-29|\\d{4}-(?:(?:0[13578]|1[02])-(?:0[1-9]|[12]\\d|3[01])|(?:0[469]|11)-(?:0[1-9]|[12]\\d|30)|(?:02)-(?:0[1-9]|1\\d|2[0-8])))T(?:(?:[01]\\d|2[0-3]):[0-5]\\d:[0-5]\\d(?:\\.\\d+)?(?:Z|([+-](?:[01]\\d|2[0-3]):[0-5]\\d)))$"
                  },
                  {
                    "pattern": "T\\d{2}:\\d{2}:\\d{2}(?:\\.\\d{1,3})?(?:Z|[+-]\\d{2}:\\d{2})$"
                  }
                ]
              }
            ]
          },
          "previous": {
            "anyOf": [
              {
                "anyOf": [
                  {
                    "type": "string",
                    "pattern": "^[a-zA-Z0-9][a-zA-Z0-9._+-]{0,95}$"
                  },
                  {
                    "type": "object",
                    "properties": {
                      "channel": {
                        "type": "string",
                        "pattern": "^(?!(?:con|prn|aux|nul|com[1-9]|lpt[1-9])$)[a-z][a-z0-9-]{0,62}$"
                      },
                      "version": {
                        "type": "string",
                        "pattern": "^[a-zA-Z0-9][a-zA-Z0-9._+-]{0,95}$"
                      }
                    },
                    "required": [
                      "channel",
                      "version"
                    ],
                    "additionalProperties": false
                  }
                ]
              },
              {
                "type": "null"
              }
            ]
          },
          "notes": {
            "type": "array",
            "items": {
              "type": "object",
              "properties": {
                "id": {
                  "type": "string",
                  "pattern": "^[a-zA-Z0-9][a-zA-Z0-9._+-]{0,95}$"
                },
                "category": {
                  "type": "string",
                  "enum": [
                    "feature",
                    "improvement",
                    "fix",
                    "security"
                  ]
                },
                "title": {
                  "type": "string"
                },
                "bodyMarkdown": {
                  "type": "string"
                },
                "image": {
                  "anyOf": [
                    {
                      "type": "object",
                      "properties": {
                        "alt": {
                          "type": "string"
                        },
                        "fallbackTheme": {
                          "type": "string",
                          "enum": [
                            "dark",
                            "light",
                            "shared"
                          ]
                        },
                        "variants": {
                          "type": "object",
                          "properties": {
                            "dark": {
                              "type": "object",
                              "properties": {
                                "src": {
                                  "type": "string"
                                },
                                "width": {
                                  "type": "integer",
                                  "exclusiveMinimum": 0,
                                  "maximum": 9007199254740991
                                },
                                "height": {
                                  "type": "integer",
                                  "exclusiveMinimum": 0,
                                  "maximum": 9007199254740991
                                }
                              },
                              "required": [
                                "src",
                                "width",
                                "height"
                              ],
                              "additionalProperties": false
                            },
                            "light": {
                              "type": "object",
                              "properties": {
                                "src": {
                                  "type": "string"
                                },
                                "width": {
                                  "type": "integer",
                                  "exclusiveMinimum": 0,
                                  "maximum": 9007199254740991
                                },
                                "height": {
                                  "type": "integer",
                                  "exclusiveMinimum": 0,
                                  "maximum": 9007199254740991
                                }
                              },
                              "required": [
                                "src",
                                "width",
                                "height"
                              ],
                              "additionalProperties": false
                            },
                            "shared": {
                              "type": "object",
                              "properties": {
                                "src": {
                                  "type": "string"
                                },
                                "width": {
                                  "type": "integer",
                                  "exclusiveMinimum": 0,
                                  "maximum": 9007199254740991
                                },
                                "height": {
                                  "type": "integer",
                                  "exclusiveMinimum": 0,
                                  "maximum": 9007199254740991
                                }
                              },
                              "required": [
                                "src",
                                "width",
                                "height"
                              ],
                              "additionalProperties": false
                            }
                          },
                          "additionalProperties": false
                        }
                      },
                      "required": [
                        "alt",
                        "fallbackTheme",
                        "variants"
                      ],
                      "additionalProperties": false
                    },
                    {
                      "type": "null"
                    }
                  ]
                }
              },
              "required": [
                "id",
                "category",
                "title",
                "bodyMarkdown",
                "image"
              ],
              "additionalProperties": false
            }
          }
        },
        "required": [
          "version",
          "releasedAt",
          "previous",
          "notes"
        ],
        "additionalProperties": false
      }
    }
  },
  "required": [
    "schemaVersion",
    "currentVersion",
    "locale",
    "releases"
  ],
  "additionalProperties": false,
  "$id": "urn:releasekit:bundle:1"
}
