{
  "schemaVersion": 1,
  "currentVersion": "1.4.0",
  "locale": "ko-KR",
  "releases": [
    {
      "version": "1.4.0",
      "releasedAt": "2026-09-08",
      "previous": "1.3.0",
      "notes": [
        {
          "id": "queue-action",
          "category": "improvement",
          "title": "대기열에 빠르게 추가",
          "bodyMarkdown": "저장한 항목을 오른쪽으로 스와이프하면 대기열에 추가할 수 있습니다.",
          "image": {
            "alt": "목록의 가운데 항목을 오른쪽으로 밀어 파란색 대기열 추가 버튼을 표시한 모습",
            "fallbackTheme": "dark",
            "variants": {
              "dark": { "src": "queue-action/dark.png", "width": 1586, "height": 992 },
              "light": { "src": "queue-action/light.png", "width": 1586, "height": 992 }
            }
          }
        }
      ]
    },
    {
      "version": "1.3.0",
      "releasedAt": "2026-09-01",
      "previous": "1.2.0",
      "notes": [
        {
          "id": "queue-action",
          "category": "improvement",
          "title": "대기열 순서 변경",
          "bodyMarkdown": "대기열에서 항목을 길게 누른 뒤 원하는 위치로 드래그하면 순서를 변경할 수 있습니다.",
          "image": null
        }
      ]
    },
    {
      "version": "1.2.0",
      "releasedAt": "2026-08-25",
      "previous": null,
      "notes": [
        {
          "id": "saved-list",
          "category": "feature",
          "title": "저장 목록",
          "bodyMarkdown": "나중에 다시 볼 항목을 저장할 수 있습니다. 저장한 항목은 사이드바의 저장 목록에서 확인하세요.",
          "image": null
        }
      ]
    }
  ]
}
