{
  "schemaVersion": 1,
  "currentVersion": "1.4.0",
  "locale": "en-US",
  "releases": [
    {
      "version": "1.4.0",
      "releasedAt": "2026-09-08",
      "previous": "1.3.0",
      "notes": [
        {
          "id": "queue-action",
          "category": "improvement",
          "title": "Quick Queue Action",
          "bodyMarkdown": "Swipe right on a saved item to add it to your queue.",
          "image": {
            "alt": "The middle list row is shifted right to reveal a blue add-to-queue action",
            "fallbackTheme": "dark",
            "variants": {
              "dark": { "src": "queue-action/dark.png", "width": 1586, "height": 992 },
              "light": { "src": "queue-action/light.png", "width": 1586, "height": 992 }
            }
          }
        }
      ]
    },
    {
      "version": "1.3.0",
      "releasedAt": "2026-09-01",
      "previous": "1.2.0",
      "notes": [
        {
          "id": "queue-action",
          "category": "improvement",
          "title": "Reorder Your Queue",
          "bodyMarkdown": "Press and hold an item in your queue, then drag it to change its position.",
          "image": null
        }
      ]
    },
    {
      "version": "1.2.0",
      "releasedAt": "2026-08-25",
      "previous": null,
      "notes": [
        {
          "id": "saved-list",
          "category": "feature",
          "title": "Saved List",
          "bodyMarkdown": "Save items to revisit later. Open Saved List in the sidebar to find them.",
          "image": null
        }
      ]
    }
  ]
}
